Name,DataType,MinCardinality,MaxCardinality,Description,Ordered,AllowSubtypes,MinLength,MaxLength,Enumeration,Pattern,MinInclusive,MinExclusive,MaxInclusive,MaxExclusive,DeprecatedNamespace,DeprecatedElementOrAttribute,DeprecatedChoiceGroup
Size,Dimensions,0,1,The size of the slices of bread,,,,,,,,,,,,,
Gyearmonth,gYearMonth,0,1,The year and month of bread,,,,,,,,,,,,,
Gyear,gYear,0,n,The list of year,,,,,,,,,,,,,
Gmonth,gMonth,0,n,The list of month,,,,,,,,,,,,,
Gday,gDay,0,n,The list of day,,,,,,,,,,,,,
GMonthDay,gMonthDay,0,n,The list of month and day,,,,,,,,,,,,,
GYearMonthList,gYearMonth,0,n,The list of years and months,,,,,,,,,,,,,
